{
  "schema_version": "1.0.0",
  "decision_id": "22222222-2222-4222-8222-222222222222",
  "source_snapshot_id": "11111111-1111-4111-8111-111111111111",
  "created_at": "2026-07-20T16:00:05Z",
  "edition": "desktop_bridge_free",
  "session_id": "session_starter_01",
  "dialogue": {
    "lines": [
      {
        "speaker": "companion",
        "text": "Let's start small — plant a seed on the farm plot and claim your first home light."
      }
    ],
    "companion_expression": "warm"
  },
  "quest_operations": [
    {
      "op": "offer",
      "quest_id": "onboarding_first_home",
      "title": "First Light at Home",
      "objective_summary": "Visit the farm plot and acknowledge the house placeholder."
    }
  ],
  "build_proposals": [],
  "event_proposals": [
    {
      "event_type": "onboarding.nudge",
      "summary": "Highlight farm plot and house silhouette.",
      "intensity": 0.4
    }
  ],
  "mood_delta": { "delta": 0.02, "reason": "friendly onboarding" },
  "relationship_delta": { "delta": 0.01, "reason": "first shared plan" },
  "next_trigger": { "kind": "player_action", "hint": "await interact on farm_plot_01" },
  "pacing_hint": { "tempo": "slow", "note": "gentle first minutes" },
  "trace": {
    "trace_id": "trace_snap_desktop_01",
    "model_receipt_ref": "bridge:manual:decision:001",
    "provider_label": "desktop_bridge"
  }
}
