{
  "schema_version": "1.0.0",
  "decision_id": "33333333-3333-4333-8333-333333333333",
  "source_snapshot_id": "11111111-1111-4111-8111-111111111111",
  "created_at": "2026-07-20T16:05:00Z",
  "edition": "desktop_bridge_free",
  "session_id": "session_starter_01",
  "dialogue": {
    "lines": [
      {
        "speaker": "companion",
        "text": "I can sketch a small cozy house here. You'll preview it before anything solid appears."
      }
    ],
    "companion_expression": "curious"
  },
  "quest_operations": [
    {
      "op": "update_objective",
      "quest_id": "onboarding_first_home",
      "objective_summary": "Preview and confirm the cozy house proposal."
    }
  ],
  "build_proposals": [
    {
      "proposal_id": "44444444-4444-4444-8444-444444444444",
      "operation": "create",
      "recipe_id": "cozy_house_small",
      "entity_kind": "modular_structure_2_5d",
      "routes_through": "preview_confirm_commit",
      "preview_required": true,
      "confirmation_state": "pending",
      "space_id": "home_01",
      "chunk_id": "0_0",
      "transform": { "x": 8.0, "y": 6.0, "elevation": 0.0, "rotation_deg": 0.0 },
      "rationale": "Starter house for onboarding vertical slice."
    }
  ],
  "event_proposals": [
    {
      "event_type": "narrative.beat",
      "summary": "House sketch offered; wait for player confirm.",
      "intensity": 0.5
    }
  ],
  "mood_delta": { "delta": 0.03, "reason": "shared build excitement" },
  "relationship_delta": { "delta": 0.02, "reason": "collaborative proposal" },
  "next_trigger": { "kind": "player_action", "hint": "await preview confirm or cancel" },
  "trace": {
    "trace_id": "trace_build_proposal_01",
    "model_receipt_ref": "bridge:manual:decision:002",
    "provider_label": "desktop_bridge"
  }
}
